{
  "schema_version": "1.0.0",
  "product_slug": "multi-repo-graph",
  "harness_version": "1.0.0",
  "port_block": {
    "start": 33000,
    "range": 50
  },
  "timeouts": {
    "health_check_seconds": 30,
    "scenario_timeout_ms": 30000,
    "run_timeout_seconds": 120
  },
  "network_policy": {
    "mode": "sealed",
    "allowed_egress": []
  }
}
